results/plots/metric_comparison.csv

model_version,experiment,metric_name,metric_value
v1,in_region_ca,mae,0.017326808303085636
v1,in_region_ca,rmse,0.03331996832574658
v1,in_region_ca,mape,352.72480562281334
v1,in_region_ca,r2,0.9458902648514581
v1,in_region_ca,skill_score,8.618008792319532
v1,in_region_ca,peak_mae,0.034362148896451075
v1,in_region_tx,mae,0.03558978106357091
v1,in_region_tx,rmse,0.07386790549188804
v1,in_region_tx,mape,77.69020134023545
v1,in_region_tx,r2,0.9393804427373282
v1,in_region_tx,skill_score,55.66880581623456
v1,in_region_tx,peak_mae,0.07788419043164996
v1,zero_shot,mae,0.1657261262930322
v1,zero_shot,rmse,0.3764602327674953
v1,zero_shot,mape,606.1434376818708
v1,zero_shot,r2,0.5157487313813482
v1,zero_shot,skill_score,28.993498562163367
v1,zero_shot,peak_mae,0.3338419009430797

results/all_results.md

### in_region_ca (ny_days=0)

- mae: 0.0173
- rmse: 0.0333
- mape: 352.7248
- r2: 0.9459
- skill_score: 8.6180
- peak_mae: 0.0344
- generalization_gap: 
- timestamp: 2026-04-21T02:19:13
- checkpoint_s3_path: s3://cs7180-final-project/checkpoints/2026-04-21_01-40-26/solar-epoch=04-val_loss=0.0042.ckpt

### in_region_tx (ny_days=0)

- mae: 0.0356
- rmse: 0.0739
- mape: 77.6902
- r2: 0.9394
- skill_score: 55.6688
- peak_mae: 0.0779
- generalization_gap: 
- timestamp: 2026-04-21T02:41:31
- checkpoint_s3_path: s3://cs7180-final-project/checkpoints/2026-04-21_01-40-26/solar-epoch=04-val_loss=0.0042.ckpt

### zero_shot (ny_days=0)

- mae: 0.1657
- rmse: 0.3765
- mape: 606.1435
- r2: 0.5157
- skill_score: 28.9935
- peak_mae: 0.3338
- generalization_gap: 
- timestamp: 2026-04-21T08:39:36
- checkpoint_s3_path: s3://cs7180-final-project/checkpoints/2026-04-21_01-40-26/solar-epoch=04-val_loss=0.0042.ckpt